Indikator,Merkmal,BZR 070505,Bezirk,Berlin,Rang (von 7)
A6,Anteil der Kinder mit 2 oder mehr Impfdosen gegen Masern,96,93.1,92.6,1
A7,Anteil der Kinder mit unversorgten Zähnen ,12.9,12.4,12.6,5
A8,Anteil der Kinder mit Dokumentation der U8,96.2,96.5,93.3,6
A9,"Anteil der Kinder, bei denen mind. eine Person im Haushalt raucht",33.9,23.7,25.4,5
A11,Anteil der übergewichtigen Kinder,10.2,9.3,9.8,5
A12,Anteil der Kinder mit auffälligen Testergebnissen in der Visuomotorik,21.1,20.3,21,4
A14,Anteil der Kinder mit Sprachdefiziten (kombinierter Indikator),21.5,27.9,27.8,3
